id	points	project_name	project_resume	project_text	author	project_img
1	48	Проект по переработке отходов	Переработка пластиковых и других отходов в новые полезные продукты	Создание предприятия, которое занимается переработкой пластика или других отходов с целью превращения их в новые продукты (например, мебель, строительные материалы). Учитывая рост проблем с экологией, этот проект может иметь большой социальный и экологический эффект. Этот проект может требовать значительных инвестиций от 5 тыс. до нескольких миллионов долларов для оборудования и запуска производства.	10	plastic.jpg
2	56	Агротехнологии	Разработка умных технологий для сельского хозяйства: использование дронов для мониторинга посевов или IoT-систем для автоматизации управления поливом и удобрениями.	Целевой рынок: Фермеры и агрокомпании стремящиеся повысить эффективность и устойчивость своего производства. Начальные инвестиции могут составлять от 2 тыс. до 3 миллионов долларов в зависимости от сложности разработки технологий и масштабов производства.	10	agriculture.jpg
3	31	Стартап в области устойчивой энергетики	Разработка новых материалов для повышения эффективности солнечных панелей и внедрение технологий позволяющих эффективно использовать возобновляемые источники энергии.	Запуск стартапа, фокусирующегося на инновационных решениях в области устойчивой энергетики. Это может быть, например, разработка новых материалов для повышения эффективности солнечных панелей или внедрение технологий, позволяющих эффективно использовать возобновляемые источники энергии. Изначальная стадия может требовать инвестиций в размере от 1 тыс. до нескольких миллионов долларов (в зависимости от сложности проекта) для исследований разработки и тестирования.	6	New_materials.jpg
4	27	Услуга по улучшению здоровья и благополучия	Разработка мобильного приложения для персонализированных планов питания и тренировок 	Мобильное приложение будет предлагать пользователям персонализированные планы питания и тренировок на основе их целей и данных о здоровье. Включение социальных функций может мотивировать пользователей. Пример: создание сообществ для обмена опытом и поддержки. Инвестиции могут варьироваться от 1 тыс. до 1 миллиона долларов в зависимости от сложности и функционала приложения.	5	health.jpg
5	5	Платформа для онлайн-образования	Платформа предлагающая курсы по востребованным навыкам	Создание интерактивной платформы которая предлагает курсы и программы по востребованным навыкам (программирование или цифровой маркетинг и т.д.). Платформа может включать элементы геймификации и персонализированные учебные траектории. Платформа могла бы также включать дополнительные функции: вебинары; обсуждения и сертификаты по окончании курсов. Начальные инвестиции могут составлять от 25 тыс. до 2 миллионов долларов включая разработку платформы и маркетинг.	3	leaning.jpg
6	35	новый проект	Описание	Текст	2	person_2.jpg
7	6	Английский язык	Проект об Английском языке	Проект может помочь вам лучше понять Английский язык.	1	sunrises-and-sunsets-scenery-grass-hill-5k-496x234.jpg
8	0	Тестовый проект2	thdfhfdjhf	jghjhjg	10	Screenshot_20230115-144821.jpg
